<?xml version="1.0" encoding="UTF-8" standalone="no"?>
<!DOCTYPE Iso8583PostXml SYSTEM "./mygeneric.dtd">
<Iso8583PostXml>
    <MsgType
    />
    <Fields>
        <Field_002
                id="2"
                length="19"
                name="PAN - PRIMARY ACCOUNT NUMBER"
                class="org.jpos.iso.IFA_LLNUM"/>
        <Field_003
                id="3"
                length="6"
                name="PROCESSING CODE"
                class="org.jpos.iso.IFA_NUMERIC"/>
        <Field_004
                id="4"
                length="12"
                name="AMOUNT, TRANSACTION"
                class="org.jpos.iso.IFA_NUMERIC"/>
        <Field_005
                id="5"
                length="12"
                name="AMOUNT, SETTLEMENT"
                class="org.jpos.iso.IFA_NUMERIC"/>
        <!--<Field_006-->
        <!--id="6"-->
        <!--length="12"-->
        <!--name="AMOUNT, CARDHOLDER BILLING"-->
        <!--class="org.jpos.iso.IFA_NUMERIC"/>-->
        <Field_007
                id="7"
                length="10"
                name="TRANSMISSION DATE AND TIME"
                class="org.jpos.iso.IFA_NUMERIC"/>
        <!--<Field_008-->
        <!--id="8"-->
        <!--length="8"-->
        <!--name="AMOUNT, CARDHOLDER BILLING FEE"-->
        <!--class="org.jpos.iso.IFA_NUMERIC"/>-->
        <Field_009
                id="9"
                length="8"
                name="CONVERSION RATE, SETTLEMENT"
                class="org.jpos.iso.IFA_NUMERIC"/>
        <!--<Field_010-->
        <!--id="10"-->
        <!--length="8"-->
        <!--name="CONVERSION RATE, CARDHOLDER BILLING"-->
        <!--class="org.jpos.iso.IFA_NUMERIC"/>-->
        <Field_011
                id="11"
                length="6"
                name="SYSTEM TRACE AUDIT NUMBER"
                class="org.jpos.iso.IFA_NUMERIC"/>
        <Field_012
                id="12"
                length="6"
                name="TIME, LOCAL TRANSACTION"
                class="org.jpos.iso.IFA_NUMERIC"/>
        <Field_013
                id="13"
                length="4"
                name="DATE, LOCAL TRANSACTION"
                class="org.jpos.iso.IFA_NUMERIC"/>
        <Field_014
                id="14"
                length="4"
                name="DATE, EXPIRATION"
                class="org.jpos.iso.IFA_NUMERIC"/>
        <Field_015
                id="15"
                length="4"
                name="DATE, SETTLEMENT"
                class="org.jpos.iso.IFA_NUMERIC"/>
        <Field_016
                id="16"
                length="4"
                name="DATE, CONVERSION"
                class="org.jpos.iso.IFA_NUMERIC"/>
        <!--<Field_017-->
        <!--id="17"-->
        <!--length="4"-->
        <!--name="DATE, CAPTURE"-->
        <!--class="org.jpos.iso.IFA_NUMERIC"/>-->
        <Field_018
                id="18"
                length="4"
                name="MERCHANTS TYPE"
                class="org.jpos.iso.IFA_NUMERIC"/>
        <!--<isofield-->
        <!--id="19"-->
        <!--length="3"-->
        <!--name="ACQUIRING INSTITUTION COUNTRY CODE"-->
        <!--class="org.jpos.iso.IFA_NUMERIC"/>-->
        <!--<isofield-->
        <!--id="20"-->
        <!--length="3"-->
        <!--name="PAN EXTENDED COUNTRY CODE"-->
        <!--class="org.jpos.iso.IFA_NUMERIC"/>-->
        <!--<isofield-->
        <!--id="21"-->
        <!--length="3"-->
        <!--name="FORWARDING INSTITUTION COUNTRY CODE"-->
        <!--class="org.jpos.iso.IFA_NUMERIC"/>-->
        <Field_022
                id="22"
                length="3"
                name="POINT OF SERVICE ENTRY MODE"
                class="org.jpos.iso.IFA_NUMERIC"/>
        <Field_023
                id="23"
                length="3"
                name="CARD SEQUENCE NUMBER"
                class="org.jpos.iso.IFA_NUMERIC"/>
        <Field_024
                id="24"
                length="3"
                name="NETWORK INTERNATIONAL IDENTIFIEER"
                class="org.jpos.iso.IFA_NUMERIC"/>
        <Field_025
                id="25"
                length="2"
                name="POINT OF SERVICE CONDITION CODE"
                class="org.jpos.iso.IFA_NUMERIC"/>
        <Field_026
                id="26"
                length="2"
                name="POINT OF SERVICE PIN CAPTURE CODE"
                class="org.jpos.iso.IFA_NUMERIC"/>
        <Field_027
                id="27"
                length="1"
                name="AUTHORIZATION IDENTIFICATION RESP LEN"
                class="org.jpos.iso.IFA_NUMERIC"/>
        <Field_028
                id="28"
                length="9"
                name="AMOUNT, TRANSACTION FEE"
                class="org.jpos.iso.IFA_AMOUNT"/>
        <Field_029
                id="29"
                length="9"
                name="AMOUNT, SETTLEMENT FEE"
                class="org.jpos.iso.IFA_AMOUNT"/>
        <Field_030
                id="30"
                length="9"
                name="AMOUNT, TRANSACTION PROCESSING FEE"
                class="org.jpos.iso.IFA_AMOUNT"/>
        <Field_031
                id="31"
                length="9"
                name="AMOUNT, SETTLEMENT PROCESSING FEE"
                class="org.jpos.iso.IFA_AMOUNT"/>
        <Field_032
                id="32"
                length="11"
                name="ACQUIRING INSTITUTION IDENT CODE"
                class="org.jpos.iso.IFA_LLNUM"/>
        <Field_033
                id="33"
                length="11"
                name="FORWARDING INSTITUTION IDENT CODE"
                class="org.jpos.iso.IFA_LLNUM"/>
        <!--<isofield-->
        <!--id="34"-->
        <!--length="28"-->
        <!--name="PAN EXTENDED"-->
        <!--class="org.jpos.iso.IFA_LLCHAR"/>-->
        <Field_035
                id="35"
                length="37"
                name="TRACK 2 DATA"
                class="org.jpos.iso.IFA_LLNUM"/>
        <!--<isofield-->
        <!--id="36"-->
        <!--length="104"-->
        <!--name="TRACK 3 DATA"-->
        <!--class="org.jpos.iso.IFA_LLLCHAR"/>-->
        <Field_037
                id="37"
                length="12"
                name="RETRIEVAL REFERENCE NUMBER"
                class="org.jpos.iso.IF_CHAR"/>
        <Field_038
                id="38"
                length="6"
                name="AUTHORIZATION IDENTIFICATION RESPONSE"
                class="org.jpos.iso.IF_CHAR"/>
        <Field_039
                id="39"
                length="2"
                name="RESPONSE CODE"
                class="org.jpos.iso.IF_CHAR"/>
        <Field_040
                id="40"
                length="3"
                name="SERVICE RESTRICTION CODE"
                class="org.jpos.iso.IF_CHAR"/>
        <Field_041
                id="41"
                length="8"
                name="CARD ACCEPTOR TERMINAL IDENTIFICACION"
                class="org.jpos.iso.IF_CHAR"/>
        <Field_042
                id="42"
                length="15"
                name="CARD ACCEPTOR IDENTIFICATION CODE"
                class="org.jpos.iso.IF_CHAR"/>
        <Field_043
                id="43"
                length="40"
                name="CARD ACCEPTOR NAME/LOCATION"
                class="org.jpos.iso.IF_CHAR"/>
        <Field_044
                id="44"
                length="25"
                name="ADITIONAL RESPONSE DATA"
                class="org.jpos.iso.IFA_LLCHAR"/>
        <Field_045
                id="45"
                length="76"
                name="TRACK 1 DATA"
                class="org.jpos.iso.IFA_LLCHAR"/>
        <!--<Field_046-->
        <!--id="46"-->
        <!--length="999"-->
        <!--name="ADITIONAL DATA - ISO"-->
        <!--class="org.jpos.iso.IFA_LLLCHAR"/>-->
        <!--<isofield-->
        <!--id="47"-->
        <!--length="999"-->
        <!--name="ADITIONAL DATA - NATIONAL"-->
        <!--class="org.jpos.iso.IFA_LLLCHAR"/>-->
        <Field_048
                id="48"
                length="999"
                name="ADITIONAL DATA - PRIVATE"
                class="org.jpos.iso.IFA_LLLCHAR"/>
        <Field_049
                id="49"
                length="3"
                name="CURRENCY CODE, TRANSACTION"
                class="org.jpos.iso.IF_CHAR"/>
        <Field_050
                id="50"
                length="3"
                name="CURRENCY CODE, SETTLEMENT"
                class="org.jpos.iso.IF_CHAR"/>
        <!--<isofield-->
        <!--id="51"-->
        <!--length="3"-->
        <!--name="CURRENCY CODE, CARDHOLDER BILLING"-->
        <!--class="org.jpos.iso.IF_CHAR"/>-->
        <Field_052
                id="52"
                length="8"
                name="PIN DATA"
                class="org.jpos.iso.IFB_BINARY"/>
        <Field_053
                id="53"
                length="48"
                name="SECURITY RELATED CONTROL INFORMATION"
                class="org.jpos.iso.IFB_BINARY "/>
        <Field_054
                id="54"
                length="120"
                name="ADDITIONAL AMOUNTS"
                class="org.jpos.iso.IFA_LLLCHAR"/>
        <!--<isofield-->
        <!--id="55"-->
        <!--length="999"-->
        <!--name="RESERVED ISO"-->
        <!--class="org.jpos.iso.IFA_LLLCHAR"/>-->
        <Field_056
                id="56"
                length="4"
                name="MESSAGE REASON CODE"
                class="org.jpos.iso.IFA_LLLCHAR"/>
        <Field_057
                id="57"
                length="3"
                name="AUTHORIZATION LIFE-CYCLE CODE"
                class="org.jpos.iso.IFA_LLLCHAR"/>
        <Field_058
                id="58"
                length="11"
                name="AUTHORIZING AGENT ID CODE"
                class="org.jpos.iso.IFA_LLLCHAR"/>
        <Field_059
                id="59"
                length="255"
                name="ECHO DATA"
                class="org.jpos.iso.IFA_LLLCHAR"/>
        <!--<isofield-->